{
    "splitIds": [
        "VengefulSpirit",
        "MothwingCloak",
        "MegaMossCharger",
        "MantisClaw",
        "MantisLords",
        "FragileStrength",
        "DesolateDive",
        "ShamanStone",
        "CrystalGuardian1",
        "CrystalHeart",
        "DreamNail",
        "Xero",
        "Gorb",
        "KingdomsEdge",
        "KingsStationStation",
        "GorgeousHusk",
        "BlackKnight",
        "Lemm2"
    ],
    "ordered": true,
    "endTriggeringAutosplit": false,
    "gameName": "Hollow Knight Category Extensions",
    "categoryName": "All Unbreakable Charms",
    "variables": {
        "platform": "PC",
        "patch": "1.4.3.2",
        "glitch": "Current Patch NMG"
    }
}
