{
    "splitIds": [
        "VengefulSpirit",
        "Greenpath",
        "MothwingCloak",
        "MantisClaw",
        "BlueLake",
        "DreamNail",
        "DesolateDive",
        "StoreroomsStation",
        "ElderbugFlower"
    ],
    "ordered": true,
    "endTriggeringAutosplit": true,
    "gameName": "Hollow Knight Category Extensions",
    "categoryName": "Elderbug%",
    "variables": {
        "platform": "PC",
        "patch": "1.4.3.2",
        "glitch": "No Major Glitches"
    }
}
