{
    "splitIds": [
        "VengefulSpirit",
        "Greenpath",
        "Zote1",
        "MothwingCloak",
        "ShamanStone",
        "MantisClaw",
        "BrettaRescued",
        "DeepnestSpa",
        "Zote2",
        "TramPass",
        "NailUpgrade1",
        "MonarchWings",
        "LittleFool",
        "ZoteKilled",
        "DreamNail",
        "GreyPrince"
    ],
    "ordered": true,
    "endTriggeringAutosplit": true,
    "gameName": "Hollow Knight Category Extensions",
    "categoryName": "GPZ%",
    "variables": {
        "platform": "PC",
        "patch": "1.4.3.2",
        "glitch": "Current Patch NMG"
    }
}
