{
    "splitIds": [
        "FuryOfTheFallen",
        "VengefulSpirit",
        "SoulCatcher",
        "Greenpath",
        "MothwingCloak",
        "NotchShrumalOgres",
        "Dashmaster",
        "MantisClaw",
        "Lemm2",
        "SpellTwister",
        "DesolateDive",
        "SlyKey",
        "CrystalHeart",
        "DeepFocus",
        "NotchSalubra1",
        "DreamNail",
        "Dreamshield",
        "BaldurShell",
        "NightmareLantern",
        "ElegantKey",
        "Grimmchild",
        "NotchFogCanyon",
        "ShadeSoul",
        "ThornsOfAgony",
        "Grimmchild2",
        "SoulEater",
        "LittleFool",
        "ColosseumBronze",
        "TroupeMasterGrimm",
        "WaywardCompass",
        "GlowingWomb",
        "FragileStrength",
        "SporeShroom",
        "QuickFocus",
        "NotchSalubra4"
    ],
    "ordered": true,
    "endTriggeringAutosplit": true,
    "gameName": "Hollow Knight Category Extensions",
    "categoryName": "All Charm Notches",
    "variables": {
        "platform": "PC",
        "patch": "1.4.3.2",
        "glitch": "No Major Glitches"
    }
}
