{
    "splitIds": [
        "VengefulSpirit",
        "Greenpath",
        "MothwingCloak",
        "Aluba",
        "MantisClaw",
        "DeepnestSpa",
        "QueensGardens"
    ],
    "ordered": true,
    "endTriggeringAutosplit": false,
    "gameName": "Hollow Knight Category Extensions",
    "categoryName": "Al2ba%",
    "variables": {
        "platform": "PC",
        "patch": "1.4.3.2",
        "glitch": "Current Patch NMG"
    }
}
