{
    "splitIds": [
        "FuryOfTheFallen",
        "VengefulSpirit",
        "Greenpath",
        "Zote1",
        "MothwingCloak",
        "NotchShrumalOgres",
        "MantisClaw",
        "Grub1",
        "CityOfTears",
        "Lemm2",
        "SpellTwister",
        "DesolateDive",
        "Grub2",
        "SimpleKey",
        "Grub3",
        "Grub4",
        "CrystalPeak",
        "Grub5",
        "SlyKey",
        "CrystalHeart",
        "Grub6",
        "Grub7",
        "Grub8",
        "Grub9",
        "DescendingDark",
        "DreamNail",
        "Dreamshield",
        "Grub10",
        "ShamanStone",
        "ElegantKey",
        "ShadeSoul",
        "Grub11",
        "DungDefender",
        "Grub12",
        "IsmasTear",
        "MonarchWings",
        "LostKin",
        "Grub13",
        "GlowingWomb",
        "FailedKnight",
        "CycloneSlash",
        "VesselFragment1",
        "JonisBlessing",
        "Grimmchild",
        "Xero",
        "DreamGate",
        "Grub14",
        "DeepFocus",
        "CrystalGuardian2",
        "Grub15",
        "LumaflyLantern",
        "Vessel1",
        "GreatSlash",
        "ThornsOfAgony",
        "Grub16",
        "Grub17",
        "MegaMossCharger",
        "Grub18",
        "VesselFragment4",
        "HowlingWraiths",
        "NoEyes",
        "MaskFragment3",
        "Grimmchild2",
        "Grub19",
        "SoulEater",
        "VesselFragment5",
        "KingdomsEdge",
        "KingsBrand",
        "AbyssShriek",
        "ShadeCloak",
        "Grub20",
        "Mask1",
        "BrettaRescued",
        "MantisLords",
        "MaskFragment5",
        "TroupeMasterGrimm",
        "Grub21",
        "BroodingMawlek",
        "Grub22",
        "FragileStrength",
        "ElderHu",
        "Grub23",
        "Uumuu",
        "MaskFragment7",
        "QueensGardens",
        "LoveKey",
        "Grub24",
        "SporeShroom",
        "Grub25",
        "Grub26",
        "Grub27",
        "Marmu",
        "Grub28",
        "TraitorLord",
        "Hegemol",
        "Grub29",
        "Grub30",
        "Weaversong",
        "Galien",
        "TramPass",
        "Zote2",
        "Grub31",
        "Grub32",
        "Nosk",
        "SharpShadow",
        "Vessel2",
        "Grub33",
        "Hive",
        "Grub34",
        "Mask2",
        "Hiveblood",
        "Grub35",
        "Grub36",
        "Grub37",
        "Markoth",
        "DashSlash",
        "Grub38",
        "QuickSlash",
        "Collector",
        "Grub41",
        "Grub42",
        "Grub43",
        "Grub44",
        "BlackKnight",
        "NailUpgrade3",
        "WhiteDefender",
        "LittleFool",
        "ColosseumBronze",
        "ColosseumSilver",
        "ColosseumGold",
        "Grub45",
        "BaldurShell",
        "Grub46",
        "NightmareLanternDestroyed",
        "ShapeOfUnn",
        "GreyPrince",
        "Sprintmaster",
        "DreamNail2",
        "NotchSalubra3",
        "MaskFragment15",
        "Mask4",
        "Kingsoul",
        "Vessel3",
        "LifebloodCore",
        "VoidHeart",
        "NailUpgrade4",
        "Flukemarm",
        "GodTuner",
        "GorbP",
        "OroMatoNailBrosP",
        "MarmuP",
        "SheoPaintmasterP",
        "GalienP",
        "SlyP",
        "FailedChampionP",
        "PureVesselP",
        "XeroP",
        "MarmuP",
        "HiveKnightP",
        "WatcherKnightsP",
        "EnragedGuardianP",
        "SoulTyrantP",
        "PureVesselP"
    ],
    "ordered": true,
    "endTriggeringAutosplit": false,
    "gameName": "Hollow Knight",
    "categoryName": "112% APB",
    "variables": {
        "platform": "PC",
        "patch": "1.4.3.2"
    }
}
