{
    "splitIds": [
        "CrossroadsStation",
        "VengefulSpirit",
        "GreenpathStation",
        "MothwingCloak",
        "MantisClaw",
        "QueensStationStation",
        "GruzMother",
        "DreamNail",
        "GorgeousHusk",
        "Lemm2",
        "StoreroomsStation",
        "TollBenchBasin",
        "DeepnestSpa",
        "DeepnestStation",
        "QueensGardens",
        "QueensGardensStation",
        "StagnestStation"
    ],
    "ordered": true,
    "endTriggeringAutosplit": true,
    "gameName": "Hollow Knight Category Extensions",
    "categoryName": "All Stag Stations",
    "variables": {
        "platform": "PC",
        "patch": "1.4.3.2",
        "glitch": "No Major Glitches"
    }
}
