{
    "splitIds": [
        "KingsPass",
        "VengefulSpirit",
        "Greenpath",
        "MothwingCloak",
        "Aluba"
    ],
    "ordered": true,
    "endTriggeringAutosplit": true,
    "gameName": "Hollow Knight Category Extensions",
    "categoryName": "Aluba%",
    "variables": {
        "platform": "PC",
        "patch": "1.4.3.2",
        "glitch": "Current Patch NMG"
    }
}
